Cites,Authors,Title,Year,Source,Publisher,ArticleURL,CitesURL,GSRank,QueryDate,Type,DOI,ISSN,CitationURL,Volume,Issue,StartPage,EndPage,ECC,CitesPerYear,CitesPerAuthor,AuthorCount,Age,Abstract,FullTextURL,RelatedURL,SDG
4,"Kopila Kafle, Dol Raj Thanet, Prabin Poudel, Deepak Gautam, Goma Thapa, Pradeep Bhatt","Status and conservation threats to large mammals of the Laljhadi Mohana Biological Corridor, Nepal",2020,Journal of Animal Diversity,CMV Verlag,https://doi.org/10.29252/jad.2020.2.2.3,,263,2025-05-24 11:25:52,journal-article,10.29252/jad.2020.2.2.3,2676-685X,,2.0,2.0,16.0,33.0,4,0.8,1,6,5,"Wildlife corridors connect isolated patches of habitat and support the movement of migratory species from one site to another.Human disturbances cause forest degradation and habitat fragmentation adding to the high risk of species extinction.We laid out 44 grids of 2 km × 2 km in Laljhadi Mohana Biological Corridor (LMBC).In each grid, we generated line transects ranging from 1.5 to 2 km and a systematic line transect survey was carried out with single replication to assess the distribution and relative abundance of large mammals.GPS coordinates were recorded for each direct sighting or indirect sign.Similarly, a local household survey (n=40) and key informant interviews (n=9) were conducted to explore the local perception about existing problems, major conflicting species habitat components, conservation threats and attitude towards the large mammals.A workshop was also held to discuss information about the conflicting species, possible solutions, and the ranking of threats based on a relative ranking system.A total of 51 individuals belonging to six species of large mammals were found in LMBC.Distribution was primarily confined to the south of the corridor, and the relative abundance, in descending order, is the Blue bull (29.4%),Asian elephant (25.5%),Spotted deer (21.5%),Wild boar (15.7%),Common leopard (5.9%) and Bengal tiger (2%).Major conservation threats were forest encroachment and habitat fragmentation (Very High), followed by grazing and forest product consumption (High), natural disaster (Medium) and illegal poaching, infrastructure construction, and invasive species (Low).The LMBC was found to support six large mammals, where mostly Asian elephants and Blue bull are using it for migration.",http://jad.lu.ac.ir/article-1-74-en.pdf,,SDG 11: Sustainable Cities and Communities
0,"Kreeti Bajracharya, Dinesh Sukamani",COVID-19 Lockdown's Effect on Building Construction Projects in Kathmandu Valley Nepal,2023,SCITECH Nepal,Nepal Journals Online (JOL),https://doi.org/10.3126/scitech.v17i1.60497,,350,2025-05-24 11:25:52,journal-article,10.3126/scitech.v17i1.60497,2091-1742,,17.0,1.0,139.0,153.0,0,0.0,0,2,2,"This research intends to assess the critical factors as an effect of COVID-19 lockdown on selected building construction projects within the Kathmandu Valley in Nepal. The research identifies “Health and Safety risk management” as the most critical factor compared to the other critical components namely supply chain operation, contractual and construction financial market. This research focuses on utilizing systematic partial least squares structural equation modeling to assess the effect of COVID-19 lockdown. Further, it seeks to demonstrate the direct relationships between COVID-19 effects and the critical factors that have been affected as a result of the pandemic. The study considers these factors as essential components in assessing the overall impact of COVID-19. This study attempts to evaluate and examine the significant pandemic effects on building construction projects. Nepal-based construction firms, government agencies, and non-government organizations were surveyed to identify critical factors affected by COVID-19 in building projects. The quantitative design method of this study included the use of smart partial least squares structural equation modeling (PLS-SEM), one of the statistical tools. Information like the fundamentals of the project, its state, etc., have been considered. 104 valid responses were received out of 130 questionnaires distributed supported at less than 1 % significance level. The inner structural model analysis, with a highest value of 7.014 and a beta value of 0.474, highlights the significance of the relationship between safety and risk management factors and COVID-19 effect in building construction projects. This relationship stands out as highly significant when compared to other constructs examined in the study. The findings underscore the crucial role of safety and risk management practices in mitigating the effects of the pandemic on construction projects.",https://nepjol.info/index.php/scitech/article/download/60497/45198,,SDG 11: Sustainable Cities and Communities
0,"Krishna Prasad Poudel, Upendra Paudel",Urbanization and Its Challenges in Nepal,2023,"Urban Dynamics, Environment and Health",Springer Nature Singapore,https://doi.org/10.1007/978-981-99-5744-6_3,,129,2025-05-24 11:25:52,book-chapter,10.1007/978-981-99-5744-6_3,,,,,107.0,131.0,0,0.0,0,2,2,"UrbanizationUrbanization inUrban Nepal is a new phenomenon. Prior to 1951, towns of Kathmandu ValleyKathmandu Valley were the only confined settlements with some urban functionsUrban function and infrastructureInfrastructure. But, out of Kathmandu ValleyKathmandu Valley, few settlements were formed as hamlets or small markets comprising some commercial activities with a purpose to serve caravan traders and porters along the trade routes. In Nepali vernacular those centres named ""hatiya"". Several such centres and also including Kathmandu Valley towns were largely practised agricultural activities during the rainy seasons and followed trade and commerce activities in off-seasons. In the long historical past, architecture of all types of market centresMarket centers built as of the needs of agricultural production systems. Those towns had the similar pattern of urban morphology. The process of current urbanizationUrbanization in the country has been started along with the transformationTransformation of socialSocial, economic, and infrastructure developmentDevelopment after the democratic movement of 1951. By 2020, Nepal has claimed around 60% of its total 30 million populations of the country living within the constituent urban boundaries. It is very different case of Nepal. It is also a strange to note how the urbanizationUrbanization process within the last 70 years transformed from almost negligible to such alarming figure. This paper aims to analyse urbanizationUrbanization processes, trend of urbanization, and urban facilities entertained by the people living within the constituent urban centres. It further emphasizes on associated issues and challengesChallenges of urban centres in Nepal. The method of analysis follows the review of available resourcesResource and personal observation in the context of Nepal. Based on the in-depth analysis, it is concluded that the practice of declaration of urban centres in Nepal has not been following the scientific basis and opened up a new discourse on delineating constituent urban centres.",https://link.springer.com/content/pdf/10.1007/978-981-99-5744-6_3,,SDG 11: Sustainable Cities and Communities
1,Krishna Prasad Timalsina,"Urban Open Space as a Place for Social and Physical Well-being: Narratives from two Different Urban Settings of Kathmandu, Nepal",2021,Journal of Geographical Research,Bilingual Publishing Group,https://doi.org/10.30564/jgr.v4i1.2449,,146,2025-05-24 11:25:52,journal-article,10.30564/jgr.v4i1.2449,2630-5070,,4.0,1.0,1.0,8.0,1,0.25,1,1,4,"Increasing population and densification of the cities lead to increasing land value by the high demand of land for housing and other infrastructure developments are the reasons that tend to decreasing open spaces in Kathmandu Valley in general, and Kathmandu Metropolitan City (KMC) in particular. Urban open space has been considered as a place that is accessible to all residents and is important in the urban context as such space provides an opportunity as a place for social interaction, networking, recreation, and various physical health exercises. However, different social and economic contexts of the society reflect different patterns of its uses.Two different urban settings (core urban areas having indigenous dominant population and fringe urban areas having migrants’ dominant population) have been taken as a basis for analysis in this paper to look at how different urban societies use open spaces differently. Open spaces are not only important for maintaining urban greenery and beauty for the city but are valued for accumulating social capital and enhancing physical well-being to urban communities. These issues are analyzed through the interpretative research methodology by collecting the data through in-depth interviews, key informants’ interviews, informal conversational interviews, and nonparticipatory observation from two different urban settings of KMC.",https://journals.bilpubgroup.com/index.php/jgr/article/download/2449/2490,,SDG 11: Sustainable Cities and Communities
0,"Krishna Prasad Timalsina, Bhim Prasad Subedi",Open Space Implications in Urban Development: Reflections in Recent Urban Planning Practices in Nepal,2022,Journal of Geographical Research,Bilingual Publishing Group,https://doi.org/10.30564/jgr.v5i2.4544,,119,2025-05-24 11:25:52,journal-article,10.30564/jgr.v5i2.4544,2630-5070,,5.0,2.0,69.0,81.0,0,0.0,0,2,3,"Open space has various implications in urban development planning and has been integrated in recent urban planning approaches and practices in Nepal. The open spaces are not only important for (re)shaping the urban form but are also important for enhancing urban social life and disaster risk management, particularly for dense cities. As most of the cities in Nepal have been growing haphazardly, the cities lack sufficient open space. However, the value of open space in dense cities like Kathmandu has been recognized more after the Gorkha Earthquake 2015 as the open spaces were extensively used for risk relief, treatment, recovery, and rehabilitation during and after the earthquake. With this background, this paper presents the major planning initiatives in Nepal and discusses how recent urban plans have provisioned and initiated open spaces development by reviewing concurrent urban planning practices, particularly reviewing Periodic Plans, Integrated Urban Development Plan, Smart City Plan, and Land Development Plan. The development of open areas has not been given much attention in the earlier urban planning practice but recent urban development planning has emphasized with a special focus which is very important for sustainable and safer city development and is expected to address the current bulging urban issues of spatiality and sociability. Therefore, it is very important for integrating open space implications in city planning and such open space should be conceptualized according to the city’s geography, landscape as well as socio-cultural contexts. ",https://journals.bilpubgroup.com/index.php/jgr/article/download/4544/pdf,,SDG 11: Sustainable Cities and Communities
0,Krishna Raj Acharya,Urban Planning and Economic Development of Nepal,2018,Tribhuvan University Journal,Nepal Journals Online (JOL),https://doi.org/10.3126/tuj.v32i2.24706,,107,2025-05-24 11:25:52,journal-article,10.3126/tuj.v32i2.24706,2091-0916,,32.0,2.0,107.0,118.0,0,0.0,0,1,7,"Urban planning is an integral part of economic planning. The concept of planning has became more popular because of answering the questions; what to produce, how to produce and to whom should be produced. If there is a proper planning in urban areas of any country, then economic development is possible in those nations. In this paper, attempts were directed to explore the relationship between dependent and affecting variables (independent variables) in the time of study of urban planning. It concluded that there is no association among urban growth and urban population, number of urban areas as well as urban population percent. The identified urban indicators are regressed with urban growth which reveals that the variables are not best fitted so that the development of our nation is still in the verge of obstacle. P value of all these independent variables are insignificant (P > 0.05, 0.87 coefficients of urban population percent, 0.72 coefficient of number of urban areas and 0.09 coefficient of national population growth > 0.05).",https://www.nepjol.info/index.php/TUJ/article/download/24706/20819,,SDG 11: Sustainable Cities and Communities
3,"Kumud Chapagain, Gajendra Prasad Rauniyar",Self-medication Practices among the Peri-urban Households of Two Communities of Dharan Sub-metropolitan city of Eastern Nepal: A Descriptive Cross-sectional Study,2020,Journal of Nepal Medical Association,Journal of Nepal Medical Association (JNMA),https://doi.org/10.31729/jnma.5185,,40,2025-05-24 11:25:52,journal-article,10.31729/jnma.5185,1815-672X,,58.0,228.0,,,3,0.6,2,2,5,"Introduction: Self-medication practice is the use of medication without prescription of health care professionals. Drug resistance, drug side effects, wastage of resources, and serious health hazards including death are associated with self-medication. We conducted this study to find out the prevalence of self- medication among the peri-urban population of two randomly selected communities of Dharan, Nepal. Methods: A descriptive cross-sectional study was conducted among people residing in two randomly selected wards of peri-urban areas of Dharan from November 2017 and April 2018 after obtaining ethical clearance (IRC/1030/017). A pretested, structured self-administered questionnaire was used for data collection. Data were collected and entered in Statistical Package for the Social Sciences version 11.5; point estimate at 95% Confidence Interval was calculated along with frequency and proportion for binary data. Results: Among 426 respondents, the overall prevalence of self-medication was 312 (73.23%) at 95% Confidence Interval (67.83-78.63%). It was more common among female 158 (78.60%). Common symptoms were headache 201 (64.42%), fever 135 (43.26%), gastrointestinal 93 (29.8%) and respiratory illness 87 (27.88%). Analgesics and antipyretics 275 (88.14%) were the most common drugs self- medicated with. Seeking opinion from pharmacist 112 (35.89%) was the commonest method adopted to procure drugs and comfort 127 (40.7%) and time constraints 122 (39.1%) were the commonest reasons. Conclusions: Prevalence of self-medication among the peri-urban population was similar to other studies. Headache and fever was the common symptoms for which self-medication were adopted. Awareness regarding potential dangers of self-medication and different drug side effects are recommended at the community level.",https://www.jnma.com.np/jnma/index.php/jnma/article/download/5185/3220,,SDG 11: Sustainable Cities and Communities
4,"Kushal Pokharel, Tikeshwori Joshi, Jagannath Adhikari, Kaustuv Raj Neupane","Water Security in Urban Water Governance: A Case Study of Dhulikhel Municipality, Kavrepalanchowk, Nepal",2018,New Angle: Nepal journal of social science and public policy,Southasia Institute of Advanced Studies (SIAS),https://doi.org/10.53037/na.v5i1.10,,123,2025-05-24 11:25:52,journal-article,10.53037/na.v5i1.10,2773-8051,,5.0,1.0,32.0,48.0,4,0.57,1,4,7,"This paper locates the issue of water security within the larger discourse of Environmental Justice which has become more encompassing and broader in scope, forms and processes penetrating the issues of political, economic and cultural distribution of resources. The concept of urban governance and water security is inextricably tied as the need of improved water services historically grew with the expansion of cities calling for critical governance arrangements. In light of the above, this paper examines the existing state of water security in Dhulikhel. By examining the power relations between ‘fringe’ and the ‘core’ areas, the paper depicts the growing inequity across the 9 wards of Dhulikhel pertaining to water access and distribution based on caste, class, ethnicity and gender. Two fundamental questions that guide this paper are: 1) Why disparities exist between the core and fringe categories in Dhulikhel Municipality? 2) How does the core-fringe category shape the power of communities in the water governance? The findings clearly show that there is a huge discrimination between the core and the fringe, the poor and the non-poor within the core in water availability, distribution and decision making. Establishing an equitable water justice system calls for uprooting the existing social discrimination in water security to empower the fringe communities.",https://newangle.sias-southasia.org/index.php/new/article/download/10/8,,SDG 11: Sustainable Cities and Communities
11,"Laura Bright-Davies Laura Bright-Davies, Christoph Lüthi Christoph Lüthi, Alexander Jachnow Alexander Jachnow",DEWATS for urban Nepal: a comparative assessment for community wastewater management,2015,Waterlines,Practical Action Publishing,https://doi.org/10.3362/1756-3488.2015.012,,295,2025-05-24 11:25:52,journal-article,10.3362/1756-3488.2015.012,1756-3488,,34.0,2.0,119.0,138.0,11,1.1,4,3,10,"This paper provides a comparative assessment of community-scale decentralized wastewater treatment systems (DEWATS) in Nepal, based on three communities in urban and peri-urban locations. The analysis provides lessons for sustainable and future replications of this approach, highlighting the benefits, drivers for long-term operation and maintenance, and barriers associated with up-scaling. Nepal is experiencing the fastest rate of urbanization in the South Asian region, while sanitation and wastewater management are emerging as some of the biggest challenges in urban areas. Over 43 per cent of the population still lacks access to a toilet, and virtually all wastewater and septage is discharged into water bodies without treatment. These mounting problems of urban sanitation demand urgent and appropriate solutions. The inherent simplicity of DEWATS provides an effective, affordable, and low-maintenance option for treating wastewater. This is particularly the case for low-income communities.",https://practicalactionpublishing.com/article/2746/download,,SDG 11: Sustainable Cities and Communities
1,Laura Kunreuther,Publics of Heritage and Domestic Archives among Urban Nepalis of the Valley,2016,Political Change and Public Culture in Post-1990 Nepal,Cambridge University Press,https://doi.org/10.1017/9781316771389.012,,140,2025-05-24 11:25:52,book-chapter,10.1017/9781316771389.012,,,,,253.0,272.0,1,0.11,1,1,9,"While many have bemoaned the ‘loss of history’ in Nepal's confrontation with modernity, as in other places, this sense of loss is also what characterizes modernity1, particularly in the past two and a half decades of democratic reform. In this moment, history and heritage have become a more centrally-debated subject in the public sphere, and public urban spaces have become increasingly marked as relics or traces of the past. Ethnographers, political scientists, and cultural historians writing after the first Jan Andolan in 1990 have stressed the significance of this political transition for enabling new narratives of history. With new narratives of the cultural past, new political and cultural identities rise to the surface of social consciousness and vice versa, new political and cultural identities require new narratives of the cultural past (Lawoti, 2007; Tamang, 2008; Des Chene, 1996; Hangen, 2010; Onta and Humagain, this volume). It is no surprise that during the 1990s and early 2000s, many in Kathmandu began to write, rewrite, and preserve traces of their cultural or national heritage and their personal history through written memoirs (Hutt, 2012; Rai, this volume) and the preservation of objects and old homes.",https://www.cambridge.org/core/services/aop-cambridge-core/content/view/63F1A6AC2FE78C2B07F3F1D7486CD37A,,SDG 11: Sustainable Cities and Communities
4,"Laxman Datt Bhatt, Laxmi Pal, Shankar Singh Dhami, Kanchan Thapa",Compliance of Iron and Folic Acid Supplementation among Postpartum Urban Mothers of Kathmandu Valley,2021,Journal of Nepal Paediatric Society,Nepal Paediatric Society,https://doi.org/10.3126/jnps.v41i2.31248,,128,2025-05-24 11:25:52,journal-article,10.3126/jnps.v41i2.31248,1990-7982,,41.0,2.0,154.0,161.0,4,1.0,1,4,4,"Introduction: Globally, iron deficiency anaemia is considered as a risk factor for maternal morbidity and mortality. It is estimated to cause 591,000 perinatal deaths and 115,000 maternal deaths annually. The World Health Organisation recommends iron supplementation to first trimester to 45 days after delivery. The Government of Nepal is supplementing Iron and Folic Acid (IFA) to pregnant and postpartum women to reduce the burden of disease and deaths, however Nepal reports low compliance and coverage. We sought to determine compliance of IFA and associated factors among postnatal mothers in Kathmandu valley. Methods: This was a cross-sectional study involving 132 mothers attending the immunisation clinic. Face to face interview was done using structured questionnaire consisting of sociodemographic information, IFA, maternal knowledge and compliance practices. Statistical analysis was done using SPSS version 23. Results: We found 68.9% compliance of iron and folic acid among the respondents. The mean age of the respondents was 27.53 ± 4.6 years (Mean ± SD). Significant association was observed between the compliance of the IFA with education,age,employment status of women and family type (p < 0.00). No significant association was observed in between the compliance of IFA and religion (p = 0.93) and delivery related complications (p = 0.143). Similarly, delivery type showed significant association with the compliance of IFA (p < 0.00). Conclusions: This study concludes that mothers from Kathmandu had better compliance and coverage of IFA than provincial as well as the national average. Private pharmacy is an important service provider for urban women.",https://www.nepjol.info/index.php/JNPS/article/download/31248/30937,,SDG 11: Sustainable Cities and Communities
36,"Lekhendra Tripathee, Shichang Kang, Dipesh Rupakheti, Qianggong Zhang, Jie Huang, Mika Sillanpää","Water-Soluble Ionic Composition of Aerosols at Urban Location in the Foothills of Himalaya, Pokhara Valley, Nepal",2016,Atmosphere,MDPI AG,https://doi.org/10.3390/atmos7080102,,369,2025-05-24 11:25:52,journal-article,10.3390/atmos7080102,2073-4433,,7.0,8.0,102.0,102.0,36,4.0,6,6,9,"The total suspended particulate (TSP) samples were collected from April 2013 to April 2014 at the urban location of Pokhara valley in western Nepal. The major aims were to study, quantify, and understand the concentrations and variations of TSP and major water-soluble inorganic ions (WSIIs) in the valley with limited data. The annual average TSP mass concentration was 135.50 ± 62.91 µg/m3. The average analyzed total WSIIs accounted for 14.4% of total TSP mass. Major anions and cations in TSP samples were SO42− and Ca2+, respectively. Seasonal differences in atmospheric conditions explain the clear seasonal variations of ions, with higher concentrations during pre-monsoon and winter and lower concentrations during the monsoon period. Neutralization factor calculations suggested that Ca2+ in the Pokhara valley mostly neutralizes the acidity in the atmosphere. Principle component analysis, NO3−/SO42− ratio, and non-sea salt fraction calculations suggested that the WSIIs in the valley were mostly derived from anthropogenic activities and crustal mineral dust, which was also supported by the results from precipitation chemistry over the central Himalayas, Nepal. In addition, back trajectories analysis has suggested that the air pollution transported from and through Indo-Gangetic Plains (IGP) during the dry periods, which has resulted in high ionic loadings during this period. Average NO3−/SO42− ratio was found to be 0.69, indicating the dominance of stationary sources of TSP in Pokhara valley. Secondary inorganic aerosols can have an adverse health impact on the human population in the valley. The data set from this one-year study provides new insights into the composition of WSIIs in the foothills of the Himalayas, which can be of great importance for understanding the atmospheric environment in the region.",https://www.mdpi.com/2073-4433/7/8/102/pdf,,SDG 11: Sustainable Cities and Communities
0,Lisa Caviglia,Space and Women in Urban Nepal,2017,Sex Work in Nepal,Routledge India,https://doi.org/10.4324/9781315141893-5,,9,2025-05-24 11:25:52,book-chapter,10.4324/9781315141893-5,,,,,105.0,142.0,0,0.0,0,1,8,,,,SDG 11: Sustainable Cities and Communities
0,Maame Esi Woode,Insights into Forced Labour Among Child Domestic Workers: Evidence from Urban Nepal,2018,Child Exploitation in the Global South,Springer International Publishing,https://doi.org/10.1007/978-3-319-91177-9_9,,148,2025-05-24 11:25:52,book-chapter,10.1007/978-3-319-91177-9_9,,,,,141.0,155.0,0,0.0,0,1,7,,http://link.springer.com/content/pdf/10.1007/978-3-319-91177-9_9,,SDG 11: Sustainable Cities and Communities
