Cites,Authors,Title,Year,Source,Publisher,ArticleURL,CitesURL,GSRank,QueryDate,Type,DOI,ISSN,CitationURL,Volume,Issue,StartPage,EndPage,ECC,CitesPerYear,CitesPerAuthor,AuthorCount,Age,Abstract,FullTextURL,RelatedURL,SDG
2,Ramesh Man Singh,Biobriquetting Experience of Nepal and Nepal Academy of Science and Technology (NAST),2021,Nepal Journal of Science and Technology,Nepal Journals Online (JOL),https://doi.org/10.3126/njst.v20i1.43352,,270,2025-05-24 11:25:52,journal-article,10.3126/njst.v20i1.43352,1994-1412,,20.0,1.0,35.0,50.0,2,0.5,2,1,4,"Animal dung briquettes are widely used in rural Nepal as they are cheap, easy to make and based on local materials. But their combustion and use, have negative impact on the health of women and children. Likewise, fuelwood is also still widely used for cooking and heating, causing adverse impact on forest conservation, environment and climate change. Search for alternatives to dung and fuelwood is a continuous process andfuel briquettes based on agro-forest waste is an attractive option. NAST, since its inception in 1982, has been continuously working in this area, introducing different technologies through many projects. It extended R&D and financial support to different individuals and industries working on biobriquetting. It was able to establish a biomass laboratory and Briquette Training Centre with workshop facilities to extend R&D and pedagogic support to university, college students and private sector. Many trainings were conducted under the Biovillage program and different projects. NAST even deputed its staff as JICA expert on biomass briquetting, brought teachers and engineers from Rwanda to be trained in NAST briquette training center. Many projects on briquetting were accomplished making NAST a credible institution in the area of biobriquetting",https://www.nepjol.info/index.php/NJST/article/download/43352/33355,,SDG 11: Sustainable Cities and Communities
18,"Ratna Shila Banstola, Tetsuya Ogino, Sachiko Inoue","Self-esteem, perceived social support, social capital, and risk-behavior among urban high school adolescents in Nepal",2020,SSM - Population Health,Elsevier BV,https://doi.org/10.1016/j.ssmph.2020.100570,,326,2025-05-24 11:25:52,journal-article,10.1016/j.ssmph.2020.100570,2352-8273,,11.0,,100570.0,100570.0,18,3.6,6,3,5,"Adolescence is not only characterized by a period of exploration and experimentation but also by vulnerability to risk-behaviors (substance-use, suicidal behavior, and sexual behavior) that can have many negative consequences. Given the lack of studies in Nepal and the variable results from international studies on the association of self-esteem, perceived social support (PSS), and social capital (SC) with risk behaviors, this study aimed to assess the role of these factors by specifying different sources of PSS (family, friends, and others) and SC (family, school, and neighbors), and controlling for demographic, socioeconomic-status (SES), family, and school related factors. A total of 943 adolescents (grades 9-11) in 8 schools from 3 provinces in Nepal participated in the study, and were selected by multi-stage, cluster, random sampling. Data were collected through a self-administered questionnaire (response rate; 91.9%). Multivariate logistic regression analysis (<0.05 significance) revealed that family SC (OR = 0.83) and PSS from family (OR = 0.95) were negatively associated with substance-use. Self-esteem (OR = 0.90), family and school SC (OR = 0.80 and 0.91, respectively), and PSS from family and friends (OR = 0.95 and 0.96, respectively) were protective against suicidal risk. None of the independent variables showed a preventive association with sexual behavior, but self-esteem was positively associated (OR = 1.11). Therefore, to improve the likelihood of adolescents becoming healthy adults, family and school level interventions to enhance self-esteem, PSS, and SC are helpful in protecting them against substance use and suicidal behavior. On the other hand, adolescents with high self-esteem are at greater risk for inappropriate sexual behavior and should therefore be monitored.",https://api.elsevier.com/content/article/PII:S2352827319304562,,SDG 11: Sustainable Cities and Communities
0,Reidun Faye,Navigating Class through Education,2023,Anthropological Perspectives on Education in Nepal,Oxford University PressOxford,https://doi.org/10.1093/oso/9780192884756.003.0004,,199,2025-05-24 11:25:52,book-chapter,10.1093/oso/9780192884756.003.0004,,,,,75.0,102.0,0,0.0,0,1,2,"Abstract: The massive expansion of formal schooling in Nepal during the last three decades has resulted in a remarkable change in the social and demographic composition of the student population in Nepal, as economically deprived, low caste groups, girls, and marginalized ethnic groups participate in formal schooling to a much larger degree than earlier. Building upon ethnographic fieldwork among the urban poor in Kathmandu in the period 2010–2014, this chapter takes a closer look at how some of those who were earlier excluded from formal schooling navigate within a rapidly changing educational landscape. Analysing how poor families make choices when selecting schools for their children, and what factors that inform their education strategies, this chapter demonstrates that although the families were short on financial recourses, they managed to navigate through both private and public schooling, and many were also successful in finalizing university education. In doing so, this chapter adds to debates on how commodification of education, class production, and recent social and political changes contribute to shape the educational practices of urban poor people in Nepal and South Asia.",https://academic.oup.com/book/chapter-pdf/58089772/oso-9780192884756-chapter-4.pdf,,SDG 11: Sustainable Cities and Communities
4,"Richa Nepal, Bharosha Bhattarai",The Grim Reality of Health System Uncovered with COVID-19 Pandemic in Nepal,2020,Journal of Nepal Health Research Council,Nepal Health Research Council,https://doi.org/10.33314/jnhrc.v18i3.2755,,312,2025-05-24 11:25:52,journal-article,10.33314/jnhrc.v18i3.2755,1999-6217,,18.0,3.0,569.0,571.0,4,0.8,2,2,5,"With advent of community transmission of COVID-19 in Nepal, the number of cases continues to rise and poses threat to the fragile health system of our country. ‘Trace, isolate, test and treat’ is the strategy advocated by World Health Organization to fight against COVID-19. Despite the efforts for last nine months, Nepal lacks in some aspect of this strategy. Lack of prompt testing facilities and substandard quarantine and isolation centers, have led to mismanagement of cases. The panic regarding COVID-19, lack of adequate protective measures to healthcare workers in early stage of the pandemic, and nation-wise lockdown, has led to collateral damage in the form of increased morbidity and mortality due to non-COVID related illnesses. COVID-19 pandemic has uncovered the grim reality of the debilitated health system of our country. With mass influx of Nepali migrant workers, the epidemic is expected to grow exponentially. We need to understand that the health system of Nepal must be prepared to function to its maximum capacity in the coming days. Keywords: COVID-19; health; Nepal; pandemic",,,SDG 11: Sustainable Cities and Communities
0,"Richa Nepal, Prahlad Karki, Surendra Uraw, Madhab Lamsal",Prevalence of Vitamin D Deficiency among Patients of Acute Coronary Syndrome in a Tertiary Care Center of Eastern Nepal,2021,Journal of Nepal Medical Association,Journal of Nepal Medical Association (JNMA),https://doi.org/10.31729/jnma.5166,,365,2025-05-24 11:25:52,journal-article,10.31729/jnma.5166,1815-672X,,59.0,235.0,,,0,0.0,0,4,4,"Introduction: Vitamin D deficiency is an emerging risk factor for cardiovascular diseases. Very few studies have been done to find out vitamin D deficiency status among cardiovascular patients in Nepalese setup. This research aims to find out the prevalence of vitamin D deficiency among patients of acute coronary syndrome admitted in a tertiary care center of eastern Nepal. Methods: This was a descriptive cross-sectional study conducted among patients of acute coronary syndrome admitted in a tertiary care hospital from 1st February 2018 to 31st July 2018. Ethical clearence was taken from Institutional Review Committee of B.P. Koirala Institute of Health Sciences (Reference number: 259/074/075-IRC). Convenience sampling method was used. Data was entered in Microsoft Excel and analyzed using Statistical Package for the Social Sciences version 25. Point estimate at 95% Confidence Interval was calculated along with frequency and proportion for binary data. Results: A total of 33 (64.7%) at 95% Confidence Interval (51.58-77.82) patients of acute coronary syndrome had vitamin D deficiency in our study with 19 (37.3%) having mild deficiency and 14 (27.4%) having moderate deficiency. None of the patients had severe vitamin D deficiency in our study. The mean vitamin D levels were lower in diabetics (23.57Â±9.28ng/ml) as compared to non-diabetics (31.91Â±12.50ng/ml), in hypertensive patients (24.36Â±7.67ng/ml) as compared to non-hypertensive patients (30.97Â±13.72ng/ml), and in patients with dyslipidemia (22.86Â±6.44ng/ml) as compared to those without dyslipidemia (37.68Â±13.15ng/ml). Conclusions: Prevalence of vitamin D deficiency among patients of acute coronary syndrome in our study was comparable to various other homologous international studies.",http://www.jnma.com.np/jnma/index.php/jnma/article/download/5166/3407,,SDG 11: Sustainable Cities and Communities
2,"Rinku Gautam Joshi, Suraj Nepal, Suren Limbu","Depression, Anxiety and Stress Among Frontline Doctors of Covid Hospital in Eastern Nepal",2021,Journal of Psychiatrists' Association of Nepal,Nepal Journals Online (JOL),https://doi.org/10.3126/jpan.v10i2.49001,,322,2025-05-24 11:25:52,journal-article,10.3126/jpan.v10i2.49001,2350-8949,,10.0,2.0,22.0,26.0,2,0.5,1,3,4,"INTRODUCTION The COVID-19 pandemic has caused several mental health problems including depression, anxiety, and stress. In BPKIHS, junior resident doctors are one of the frontline health care professionals and are vulnerable to mental health problems. This study was undertaken to find out depression, anxiety, and stress in the frontline junior resident doctors (FJRD). METHODOLOGY A web-based cross-sectional study among FJRD was done from 29 August to 28 September 2020 using Depression, Anxiety, and Stress Scale (DASS-21). RESULT Among 168 FJRD, 144(85.7%) responded, and the mean age was 29.6±1.9 years. They were mostly male (56.9%), unmarried (60. 4%), living alone (77.1%), first-year junior residents (43.1%), and had last duty more than 2 weeks(56.9%). Anxiety was seen in 50%; followed by Depression in 38.1%; and Stress in 27.7%. The moderate type of Depression, Anxiety, and Stress was common which were 19.6%, 24.3% and 15.2% respectively. Depression, Anxiety and Stress was more in male (55 to 61.1%), unmarried (60-64%), living alone (76-85%) and first-year residents (37.5-43.6%) but not statistically significant. Depression, Anxiety and Stress were more in those whose last duty more than 2 weeks but statistically significant with Anxiety (p=0.03) only. There was a strong correlation among each other of depression, anxiety and stress (p=<0.05). CONCLUSION Depression, anxiety, and stress were greater in FJRD. The most common being anxiety, followed by depression and stress. In severity grading moderate was common. It shows the need for early intervention and management.",https://www.nepjol.info/index.php/JPAN/article/download/49001/36563,,SDG 11: Sustainable Cities and Communities
0,Rishi Ram Kattel,Adoption and Impact of Rainwater Harvesting Technology in Nepal,2024,Agronomy Journal of Nepal,Nepal Journals Online (JOL),https://doi.org/10.3126/ajn.v8i1.70765,,310,2025-05-24 11:25:52,journal-article,10.3126/ajn.v8i1.70765,2091-0649,,8.0,,25.0,33.0,0,0.0,0,1,1,"The rainwater harvesting (RWH) technology has been introduced to upland farmers in Nepal who have been practicing rain-fed subsistence agriculture. Using cross-sectional household level data from 282 farmers in four districts of Makwanpur, Palpa, Gulmi and Syangja, probit and treatment-effects models were used to identify factors that influence the adoption of RWH and its impact on farm income. The adoption of rain water harvesting was mostly driven by trainings that farmers received while controlling for age, poverty status and off-farm income. The adoption of RWH technology more than doubles household agricultural and livestock income. Instrumental variable approach was used to check the robustness of the findings. Adopters benefited from an increased supply of irrigation water, which allows them to diversify their crops from cereal production to high-value crops during dry season. Given the many weather-related uncertainties faced by rainfed farmers in Nepal, rain water harvesting is potentially a very useful climate adaptation strategy. These results were robust to alternative model specification and estimation method.",https://nepjol.info/index.php/AJN/article/download/70765/53958,,SDG 11: Sustainable Cities and Communities
0,"Rita Devi Karki, Naba Raj Thapa",Economic Dimension and Empowerment among Rural and Urban Women in Nepal: Analysis from 2016 Nepal Demographic and Health Survey,2022,Humanities and Social Sciences Journal,Nepal Journals Online (JOL),https://doi.org/10.3126/hssj.v13i2.49811,,112,2025-05-24 11:25:52,journal-article,10.3126/hssj.v13i2.49811,2594-3065,,13.0,2.0,123.0,134.0,0,0.0,0,2,3,"Economic background is taken as one of the crucial influencing factors of women's empowerment. This paper attempts to assess the key economic features of women and their degree of association on empowerment by place of residence. For this, the Nepal Demographic and Health Survey, 2016 data were used. In total, 9,875 currently married women aged 15-49 years were used to analyze by applying descriptive and bivariate analysis techniques. The findings showed rural women have poor economic status compared with urban women. Agriculture is the main profession of women among both rural and urban areas but the non-agricultural profession is lower especially among rural (11.7%) women to compare with urban (24.6%) women. Similarly, unpaid work seems still prevalent in both urban (46.6%) and rural (59.6%) areas. The male domination is clearly observed in earning a position with their husband, being paid in the same job, and ownership of property related to land and house. The study showed that there is a positive and significant relationship between working women and their empowerment in both rural and urban areas. The better economic status of women has higher empowerment in comparison to the women who have poor status. Hence, economic power has an automatically positive influence on women's empowerment. However, it needs to be paid high attention to improve the prevailing poor women’s economic status in different circumstances. ",https://www.nepjol.info/index.php/hssj/article/download/49811/37155,,SDG 11: Sustainable Cities and Communities
1,"Rosa Ranjit, Sarima Paudel, Rhitu Shrestha, Jyoti Maharjan, Bimala Devkota, Shandesh Bhattarai, Bishnu Pandey",Biological and Chemical Analysis of Five Selected Lichen Species from Sagarmatha National Park of Nepal,2020,Tropical Journal of Natural Product Research,University of Benin,https://doi.org/10.26538/tjnpr/v4i2.4,,380,2025-05-24 11:25:52,journal-article,10.26538/tjnpr/v4i2.4,,,4.0,2.0,43.0,49.0,1,0.2,0,7,5,,,,SDG 11: Sustainable Cities and Communities
0,Rudra Pd. Ghimire,Inversor's performance on Stock Selection Decision of Nepal Stock Exchange,2016,Economic Journal of Nepal,Nepal Journals Online (JOL),https://doi.org/10.3126/ejon.v39i1-4.77994,,359,2025-05-24 11:25:52,journal-article,10.3126/ejon.v39i1-4.77994,1018-631X,,39.0,1.0,80.0,87.0,0,0.0,0,1,9,Available in full text.,https://www.nepjol.info/index.php/EJON/article/download/77994/59761,,SDG 11: Sustainable Cities and Communities
0,"S Gautam, N Shrestha, T Shah, B Angur","Nutritional Status of Senior Citizens in Selected Rural and Urban Area of Kaski, Nepal",2018,Journal of Gandaki Medical College-Nepal,Nepal Journals Online (JOL),https://doi.org/10.3126/jgmcn.v11i1.20794,,27,2025-05-24 11:25:52,journal-article,10.3126/jgmcn.v11i1.20794,2070-4259,,11.0,1.0,46.0,51.0,0,0.0,0,4,7,"Background: Nutritional status is a valuable determinant of quality of life as well as morbidity and mortality. Adequate nutrition, including balanced diet is important among the senior citizens for maintaining good health. Objectives: To assess the nutritional status of senior citizens, compare between rural and urban and find out association between demographic variables and study parameters.Methods: A community based cross-sectional comparative study was carried out in one Municipality and one VDC of Kaski district, Nepal. Stratified random sampling was adopted to draw 120 samples from urban, 120 from rural. Data was collected by face-to-face interview with the respondents using semi-structured questionnaire. Anthropometric measurement (Height and weight) and hemoglobin measurement was done for assessment of nutritional status.Results: Underweight was found in maximum (47.5%) respondents in rural than urban (18.3%). while overweight was in maximum in urban (30.0%) than in rural (12.5%). Similarly, BMI within normal range was higher in urban (45.8%) than in rural (37.5%). Mean BMI in rural was 19.0 ±4.1 and in urban was 23.2 ±4.7. Below normal hemoglobin level was slightly higher in rural (47.5%) than in urban (44.17%). Mean hemoglobin in rural was 11.89 ±1.63 and urban was 12.06 ±1.27.Conclusions: The study concludes that, underweight was found more among in rural senior citizens but overweight was found more among in urban senior citizens. Below normal hemoglobin level was more among rural samples. There was statistically significant association of mean BMI between rural and urban but not statistically significant association of mean hemoglobin between rural and urban.  J-GMC-N | Volume 11 | Issue 01 | January-June 2018, Page: 46-51",https://www.nepjol.info/index.php/JGMCN/article/download/20794/17075,,SDG 11: Sustainable Cities and Communities
10,"Sabina Bhandari, Chuanrong Zhang","Urban Green Space Prioritization to Mitigate Air Pollution and the Urban Heat Island Effect in Kathmandu Metropolitan City, Nepal",2022,Land,MDPI AG,https://doi.org/10.3390/land11112074,,75,2025-05-24 11:25:52,journal-article,10.3390/land11112074,2073-445X,,11.0,11.0,2074.0,2074.0,10,3.33,5,2,3,"The rapid population growth and unplanned urbanization within Kathmandu Metropolitan City (KMC) have induced land use and land cover (LULC) changes that have exacerbated problems of air pollution and the Urban Heat Island (UHI) effect. These issues, as well as potential mitigations and possible counteractions, are currently under investigation by numerous research communities, resulting in various solutions being put forward including the creation of Urban Green Spaces (UGS). Establishing UGS would increase carbon dioxide extraction, minimizing photochemical ozone formation and liberation, while simultaneously cooling the microclimate of an area such as KMC. Optimized implementation of UGS throughout KMC requires an understanding of and prioritization of locations based on degraded air quality and the UHI effect. Unfortunately, such studies in these areas appear to be severely lacking, which has acted as a catalyst for this study. This research includes prioritization on two different spatial units—(i) at the administrative ward level and (ii) 0.0025° fishnet level. The result identifies the high-need locations where UGS establishment is recommended to mitigate air pollution and the UHI effect. Information obtained also heightened the existing UGS’s current sparsity and deplorable conditions. Findings from this study indicate that the utilization of rooftops are potential locations for new UGS, and enhancement of the existing UGS would prove to be an efficient use of currently underutilized spaces.",https://www.mdpi.com/2073-445X/11/11/2074/pdf,,SDG 11: Sustainable Cities and Communities
1,"Sajani Kandel, Sharmila Shyangtan",Why focus on ‘heat’? A silent disaster unfolding in Nepal,2023,International Journal of Urban and Regional Research,Urban Research Publications Ltd,https://doi.org/10.56949/2cwp2746,,110,2025-05-24 11:25:52,journal-article,10.56949/2cwp2746,,,,,,,1,0.5,1,2,2,,,,SDG 11: Sustainable Cities and Communities
27,"Samata Nepal, Alok Atreya, Ritesh G Menezes, Ruban Raj Joshi",Students’ Perspective on Online Medical Education Amidst The COVID-19 Pandemic in Nepal,2020,Journal of Nepal Health Research Council,Nepal Health Research Council,https://doi.org/10.33314/jnhrc.v18i3.2851,,384,2025-05-24 11:25:52,journal-article,10.33314/jnhrc.v18i3.2851,1999-6217,,18.0,3.0,551.0,555.0,27,5.4,7,4,5,"Background: The lockdown strategy adopted to contain the spread of current pandemic of coronavirus disease has affected all sectors of life globally. Nepal also instructed all the educational institutions to shut down, medical colleges being no exception. One month into the lockdown all the medical colleges in Nepal started online classes to keep pace with the academic calendar. This preliminary survey analyses the students’ perspective on newly introduced online medical education system. Methods: This cross-sectional survey used an online questionnaire typed in Google forms. The link to the survey was then emailed to the student representative of each semester of Lumbini Medical College, Palpa, Nepal, who were then instructed to forward it to their classmates. The questionnaire consisted of demographic variables and perspective of medical undergraduates towards online classes and also a space to comment or opine their perspective on current medical education. Results: A total of 226 students responded the survey. Almost one-third of the students (n=173, 76.5%) admitted of never having attended the online classes. Most of the students used smartphones to attend online classes; broadband internet service being the source of internet in 65.5%. Two-third of the students rated online classes to be poorer than the traditional classroom teaching and 77.8% of the students preferred traditional classroom teaching in future. Conclusions: Medical students did not find online classes as effective as the traditional classroom teachings; it could be made more interactive and productive by introducing interactive and brainstorming sessions complementing the conventional face?to?face education. Keywords: COVID-19; medical education, Nepal; online education; virtual education",,,SDG 11: Sustainable Cities and Communities
4,"Samata Nepal, Alok Atreya, Tanuj Kanchan",Teenage Pregnancies in Nepal – The Problem Status and Socio-Legal Concerns,2018,Journal of Nepal Medical Association,Journal of Nepal Medical Association (JNMA),https://doi.org/10.31729/jnma.3571,,277,2025-05-24 11:25:52,journal-article,10.31729/jnma.3571,1815-672X,,56.0,211.0,678.0,682.0,4,0.57,1,3,7,"Introduction: Teenage pregnancy is an issue that needs to be addressed for a better health of the women and the society. The present analysis is undertaken to find out the incidence of teenage mothers who have had hospital delivery and focuses upon the various reasons for teenage pregnancy with a brief discussion upon the associated medicolegal and social aspects. Methods: A cross sectional study was carried out in a tertiary hospital in western region of Nepal. The delivery case register were reviewed for teenage pregnancies and the relevant data was captured in a data sheet and analysed. Results: During the study period, a total of sixty-nine teenage pregnancies culminated into delivery/ childbirth. The mean age of teenage mother was 18.16±0.99 years. Majority of the teenage mothers had not completed their secondary education and were of low socioeconomic strata. Mode of delivery was caesarean section in thirty four cases, whereas vaginal delivery was conducted in thirty five cases. Live births accounted for 67 deliveries, a still birth case was of anencephalic foetus while the other one was a preterm which was spontaneously delivered at the 23rd weeks of gestation. Conclusions: Education and awareness in the form of campaign, advertisements, road shows, television or radio programmes are suggested for a decline in the rate of teenage marriages and teenage pregnancies in Nepal in the days to come.",https://www.jnma.com.np/jnma/index.php/jnma/article/download/3571/2757,,SDG 11: Sustainable Cities and Communities
0,"Samata Nepal, Alok Atreya, Tanuj Kanchan",Re: Teenage Pregnancies in Nepal - The Problem Status and Socio-Legal Concerns: Letter to The Editor,2019,Journal of Nepal Medical Association,Journal of Nepal Medical Association (JNMA),https://doi.org/10.31729/jnma.4570,,345,2025-05-24 11:25:52,journal-article,10.31729/jnma.4570,1815-672X,,57.0,218.0,,,0,0.0,0,3,6,,https://www.jnma.com.np/jnma/index.php/jnma/article/download/4570/2913,,SDG 11: Sustainable Cities and Communities
