Cites,Authors,Title,Year,Source,Publisher,ArticleURL,CitesURL,GSRank,QueryDate,Type,DOI,ISSN,CitationURL,Volume,Issue,StartPage,EndPage,ECC,CitesPerYear,CitesPerAuthor,AuthorCount,Age,Abstract,FullTextURL,RelatedURL,SDG
5,Chhabi Lal Chidi,"Bid-Rent Theory and Urban Land Use of Butwal Urban Area, Western Nepal",2019,The Third Pole: Journal of Geography Education,Nepal Journals Online (JOL),https://doi.org/10.3126/ttp.v18i0.27990,,76,2025-05-24 11:25:52,journal-article,10.3126/ttp.v18i0.27990,2392-4322,,,,11.0,20.0,5,0.83,5,1,6,"Modern urbanization process characterizes different land use pattern than that of classical urban land use theories. However, the general scenario of land use pattern still related to classical theories. Thus, this paper aims to assess the application of classical land use model and land economic theory in Butwal urban area of western Nepal based on field study information collected from 50 randomly selected plots of the Butwal urban area. Thematic maps of various urban land features were prepared, and regression analyses have been used. Geographic Information System (GIS), excel and Statistical Packages for Social Sciences (SPSS) software were used for data analysis. The findings of this study indicate that classical model has important role to study medium size urban land use. Simultaneously, land economic theory is also equally applicable with considering the physical and social factors of land use for urban area.",https://www.nepjol.info/index.php/TTP/article/download/27990/23073,,SDG 11: Sustainable Cities and Communities
0,Chhabi Lal Chidi,"Accessibility, Land Use, and Land Economics: A Factor Analysis Approach in Butwal Urban Area of Nepal",2023,"Urban Dynamics, Environment and Health",Springer Nature Singapore,https://doi.org/10.1007/978-981-99-5744-6_6,,84,2025-05-24 11:25:52,book-chapter,10.1007/978-981-99-5744-6_6,,,,,171.0,183.0,0,0.0,0,1,2,"Complex relationshipsFactor analysis of different urban featuresUrban features exist in an urban area. TheUrban objective of this study is to access the ecological pattern of urban featuresUrban features and their relationship. Butwal a historical town is selected as a study area which is located at the break of bulkBreak of bulk point between Hill and Tarai regionRegion of Nepal. The factor analysisFactor analysis approach was applied to assess the dimension of the relationship between accessibilityAccessibility, urban land useUrban land use, and urbanLand economics land economicsEconomics. Ten variables related to these features were derived from fifty randomly sampled patches. Only seven suitable variables were selected for factor analysis and two factors were derived from these variables. These two factors explain more than 65.61% of the total variance of the variables. Urban functionUrban function intensity has the highest value of communalityCommunality followed by landLand value and radial distanceRadial distance to the Central Business DistrictCentral Business District (CBD). Factor 1 is mostly related to urban land useUrban land use and radial distanceRadial distance to CBD. Similarly, urban economicsEconomics and actual travel distanceTravel distance to CBD are mostly related to factor 2. However, room rent is also related to radial distance to CBD. It is concluded that urban land useUrban land use pattern is mostly related to radial distanceRadial distance to CBD andLand economics land economicsEconomics is mostly related to actual travel distanceTravel distance to CBD in the study area.",https://link.springer.com/content/pdf/10.1007/978-981-99-5744-6_6,,SDG 11: Sustainable Cities and Communities
5,"Chhabi Lal Chidi, Ramesh Kumar Salami Magar, Dipendra Salami Magar",Assessment of urban heat island in Kathmandu valley (1999-2017),2021,Geographical Journal of Nepal,Nepal Journals Online (JOL),https://doi.org/10.3126/gjn.v14i0.35544,,66,2025-05-24 11:25:52,journal-article,10.3126/gjn.v14i0.35544,2565-4993,,14.0,,1.0,20.0,5,1.25,2,3,4,"Growing urbanization results built up surfaces converting from agriculture land, forest and other natural land cover surfaces. Increasing built up surfaces, means of transport and industrial activities are major results for increasing temperature in the city area as compared to other areas. Increasing heat is a concern to human health of the people living in urban areas. Increasing temperature in the city area in developing countries is being a growing concern.  Kathmandu valley is one of the most rapidly growing urbanization in Nepal. The present study aims to assess the changing Land Surface Temperature (LST) in Kathmandu valley using LANDSAT 7 images. Similarly, Urban Heat Island (UHI) effect was evaluated in land use categories which were derived from Google Earth images. Study revealed that built up area contributed highly to increase land surface temperature. New built up with compact settlement area has higher land surface temperature as compare to other land use/land cover surfaces. City core has higher LST as compared to less urbanized and surrounding parts. The LST has highly increased during 1999 to 2017 with increasing urbanization. However, the ecological condition of UHI effect is not so bad till date but the study result indicated the continuous increasing urbanization may result worse ecological condition in Kathmandu Valley in the future.",https://www.nepjol.info/index.php/gjn/article/download/35544/27787,,SDG 11: Sustainable Cities and Communities
0,Chhabi Ram Baral,"The Status of Livelihood Vulnerability and Its CopingCapacities of Urban Squatters in Kathmandu Metropolitan City, Nepal",2019,Patan Pragya,Nepal Journals Online (JOL),https://doi.org/10.3126/pragya.v5i1.30433,,201,2025-05-24 11:25:52,journal-article,10.3126/pragya.v5i1.30433,2594-3278,,5.0,1.0,19.0,32.0,0,0.0,0,1,6,"Urban poverty is one of multidimensional issue in Nepal. Increasing immigration from the outer parts of Kathmandu due to rural poverty, unemployment and weak security of the lives and the properties are core causes pushing people into urban areas. In this context how squatter urban area people sustain their livelihoods is major concern. The objectives of the study are to find out livelihood assets and capacities squatters coping with their livelihood vulnerability in adverse situation. Both qualitative and quantitative methods are applied for data collection. It is found that squatters social security is weak, victimized by severe health problems earning is not regular with lack of physical facilities and overall livelihood is critical. This study helps to understand what the changes that have occurred in livelihood patterns and how poor people survive in urban area.",https://www.nepjol.info/index.php/pragya/article/download/30433/24369,,SDG 11: Sustainable Cities and Communities
42,"Chitresh Saraswat, Binaya Kumar Mishra, Pankaj Kumar","Integrated urban water management scenario modeling for sustainable water governance in Kathmandu Valley, Nepal",2017,Sustainability Science,Springer Science and Business Media LLC,https://doi.org/10.1007/s11625-017-0471-z,,289,2025-05-24 11:25:52,journal-article,10.1007/s11625-017-0471-z,1862-4065,,12.0,6.0,1037.0,1053.0,42,5.25,14,3,8,,http://link.springer.com/content/pdf/10.1007/s11625-017-0471-z.pdf,,SDG 11: Sustainable Cities and Communities
0,Chris Crews,"Michael Hoffman, Glimpses of Hope: The rise of industrial labor at the urban margins of Nepal",2024,European Bulletin of Himalayan Research,OpenEdition,https://doi.org/10.4000/124f2,,218,2025-05-24 11:25:52,journal-article,10.4000/124f2,0943-8254,,62.0,,,,0,0.0,0,1,1,,,,SDG 11: Sustainable Cities and Communities
1,Christiane Brosius,"Care-takers and place-makers: Old-Age and urban regeneration in Patan, Nepal",2018,Global Europe – Basel Papers on Europe in a Global Perspective,University of Basel,https://doi.org/10.24437/global_europe.v0i115.172,,197,2025-05-24 11:25:52,journal-article,10.24437/global_europe.v0i115.172,2571-8118,,,115.0,,,1,0.14,1,1,7,"This article considers ageing in cities of the Global South, with a particular focus on urban transformation and place-making in the old city center of Patan, Kathmandu Valley. Building upon discussions evolving around concepts such as ‘active ageing’, ‘environmental gerontology’ and ‘age-friendly cities’, terms largely coined in northern America and western Europe, the article addresses their productivity – and challenges – when applied in the case of Nepal. It considers a larger field of ageing in the realm of transcultural place-making, since the contextualization includes global circulations of ideas and practices related to cultural heritage, transnational migration and urban transformation through economic liberalization. The ethnographic material collected between 2014–17 among Newar senior residents is discussed with respect to questions of ownership, participation and responsibility. It highlights the entangled relationship of socio-religious relations and built environment, as well as intangible heritage, seeking to stress the importance of ephemeral and interstitial spaces that do not necessarily resonate with ‘global’ concepts of public and private, wellbeing and development.",https://eterna.unibas.ch/index.php/global_europe/article/download/172/397,,SDG 11: Sustainable Cities and Communities
0,Dashrath Kafle,Nepal Earthquake: ODOAN Experience and Initiative,2015,Orthodontic Journal of Nepal,Nepal Journals Online (JOL),https://doi.org/10.3126/ojn.v5i2.15216,,276,2025-05-24 11:25:52,journal-article,10.3126/ojn.v5i2.15216,2091-1335,,5.0,2.0,5.0,5.0,0,0.0,0,1,10,"Orthodontic Journal of Nepal, Vol. 5 No. 2, June 2015, p.5",https://www.nepjol.info/index.php/OJN/article/download/15216/12311,,SDG 11: Sustainable Cities and Communities
0,"Deepa Kunwar, Snigdha Subham, Manisha Nepal, Jwolan Khadka","Knowledge, Attitude and Practice among endodontists of Nepal in patient management during COVID-19 arena",2021,Journal of Gandaki Medical College-Nepal,Nepal Journals Online (JOL),https://doi.org/10.3126/jgmcn.v14i2.38704,,341,2025-05-24 11:25:52,journal-article,10.3126/jgmcn.v14i2.38704,2070-4259,,14.0,2.0,111.0,117.0,0,0.0,0,4,4,"Background: Coronavirus disease, 2019 (COVID-19) is an infectious disease caused by the severe acute respiratorysyndrome coronavirus 2 (SARS-CoV-2).COVID-19 is a global pandemic affecting all aspects of life in all countries. Endodontist are at inherent risk because of aerosol generating procedures. The objective of the study was to assess the knowledge, attitude and practice (KAP) among Endodontists of Nepal to combat the COVID 19 pandemic. Method:A web-based cross-sectional study was conducted among Endodontist of Nepal from March to June 2021.Convenient sampling method was adopted. The data were analysed using SPSS version 20.Descriptive statistics was performed, percentage and frequency distribution were assessed. Chi-square tests wereused to see the association between the categorical variables. A p-value of <0.05 was considered statistically significant. Results:  Out of the total 81 Endodontists who responded to our study, 55.6% of them were females and 44.4% males. Around 65%were from Bagmati province.Majority (87.7%) of responders reported that they categorize the cases on the basis risk assessment, 56.8% do not perform routine procedures during the pandemic. Maximum (97.5%) of the responders discuss about COVID-19 with the patients.About 55% of the responders use rubber dam during the endodontic procedures, while 17.3% of the responders do not use them at all. Conclusion:Endodontists of Nepal werefound to have good knowledge, attitude and practice score, which is important to overcome the present pandemic scenario of COVID19.Certain pitfalls in attitude and practice level can be decreased by efficient training programs, precise guidelines, and treatment protocols.",https://www.nepjol.info/index.php/JGMCN/article/download/38704/32043,,SDG 11: Sustainable Cities and Communities
0,"Deepak Bikram Thapa Chhetri, Pukar Regmi",Importance of Local Climate Zones and Urban Heat Island study in Nepal,2023,Kathford Journal of Engineering and Management,Nepal Journals Online (JOL),https://doi.org/10.3126/kjem.v2i01.61867,,283,2025-05-24 11:25:52,journal-article,10.3126/kjem.v2i01.61867,2661-6106,,2.0,1.0,73.0,78.0,0,0.0,0,2,2,"Various scientific research and literatures have documented the effect of urbanization on local climate. Urban rural temperature and humidity difference i.e. Urban Heat Island (UHI) and Urban Dry Island (UDI) respectively have been reported for cities and regions worldwide, mostly with local field sites that are extremely diverse in their physical and climatological characteristics. Generally, the UHI study relies on simplistic descriptors such as “urban” and “rural”. While these descriptors may be evocative of the landscape, they are insufficient in providing information like its site properties which have direct impacts on the surface layer climate. To fulfil the gap and for the clarity “local climate zone” (LCZ) classification is a very good tool. Each classification is unique in its combination of surface structure, cover, and human activity. The standard framework for each zone helps to classify an area for reporting and comparing field sites and their temperature observations. The LCZ not only helps in UHI and UDI study but also helps in planning smart environment and human friendly cities, landscape, and global climate change investigation. Nepal now being a federal state, many states having smart developmental drive of cities focusing only on physical infrastructure without considering UHI effect must incorporate study of cities by LCZ for sustainable urbanization.",https://www.nepjol.info/index.php/kjem/article/download/61867/46561,,SDG 11: Sustainable Cities and Communities
1,"Deepeshwara Nepal, Sumit Agrawal, Sushan Shrestha, Ajit Rayamajhi","Morbidity Pattern and Hospital Outcome of Neonates Admitted in Tertiary Care Hospital, Nepal",2020,Journal of Nepal Paediatric Society,Nepal Paediatric Society,https://doi.org/10.3126/jnps.v40i2.29469,,330,2025-05-24 11:25:52,journal-article,10.3126/jnps.v40i2.29469,1990-7982,,40.0,2.0,107.0,113.0,1,0.2,0,4,5,"Introduction: The first 28 days of life, neonatal period is crucial as neonates are susceptible to sepsis, birth asphyxia, hypoxic injuries and its consequences which may lead to lifelong morbidity. Knowing the causes of morbidity and mortality is an essential step to improve neonatal health. The aim of this study is to describe the pattern and causes of neonatal admission, immediate hospital outcome in the form of improved, died or left against medical advice  and factors associated with its outcome. Methods: This was a retrospective hospital based study carried out in Neonatal Intensive Care Unit (NICU) of Kanti Children’s Hospital, Kathmandu, Nepal over a period of six months (February 2019 to July 2019 AD). Neonatal details including age, sex, gestational age, birth weight, and maternal age and parity, mode of delivery, place of delivery, neonatal morbidities and neonatal outcomes were recorded in a predesigned performa. Results were expressed as mean, percentage and p value. P- value was calculated by using chi-square test. Results: A total of 163 neonates were admitted during the study period, among which 106 (65%) were males. The mean birth weight was 2483.96 ± 812.63 gm. Among admitted newborns 130 (79.8%) had good outcome, babies born to young mothers (< 20 years of age) had poor outcome which is statistically significant with p value of 0.002. Neonates whose birth weight were < 1000 gram had significantly poor outcome (0.001). Conclusion: Common causes of NICU admission were neonatal sepsis, neonatal hyperbilirubinemia, prematurity and perinatal asphyxia. Babies born to young primipara mothers, extremely low birth weight, extremely premature babies and babies undergoing mechanical ventilation had poor outcome.",https://www.nepjol.info/index.php/JNPS/article/download/29469/24701,,SDG 11: Sustainable Cities and Communities
1,"Devendra Adhikari, Rajan Binayek Pasa",Private (institutional) schools: bridging social gaps in urban cities in Nepal?,2021,Research Nepal Journal of Development Studies,Nepal Journals Online (JOL),https://doi.org/10.3126/rnjds.v4i2.42680,,61,2025-05-24 11:25:52,journal-article,10.3126/rnjds.v4i2.42680,2631-2131,,4.0,2.0,28.0,39.0,1,0.25,1,2,4,"The interest of parents in the urban cities in Nepal is tending towards enrolling their children in paid private (institutional) schools, rather than free public schools. This paper aimed at exploring the reasons behind growing craziness of the parents towards the private education system in Nepal. We adopted a critical paradigm, case study approach using in-depth interviews, and observation techniques to gather field information. This study has signaled that institutional schools are facilitating to homogenize the education system between haves and have nots groups in society. Different categories of private education systems, with accountable management team have facilitated in bridging the social gaps in Nepal. At the same time, public schools urgently need to revisit their management model, pedagogical system, and publicize their services and strengths, so that they could regain their trust from the urban parents. The explorations of this research could be helpful to outline the positive aspects of private schools and buildup the public education system along in Nepal.",https://www.nepjol.info/index.php/rnjds/article/download/42680/32405,,SDG 11: Sustainable Cities and Communities
0,Dhirendra Giri,"The relationship of Obesity and Periodontal disease among Urban Population of Biratnagar, Nepal",2018,Orthodontic Journal of Nepal,Nepal Journals Online (JOL),https://doi.org/10.3126/ojn.v8i1.21348,,8,2025-05-24 11:25:52,journal-article,10.3126/ojn.v8i1.21348,2091-1335,,8.0,1.0,45.0,47.0,0,0.0,0,1,7,"Introduction: obesity has become an alarming concern worldwide. Obesity is not only a cosmetic concern, it is a health risk that threatens an individual’s wellness. As the prevalence of obesity increases so have the related health consequences.Objective: To determine the association of obesity with periodontal disease using Body Mass Index (BMI) Asian version, Oral Hygiene Index (OHI) and Community Periodontal Index (CPI) to assess the periodontal health and oral hygiene.Materials & Method: Body Mass Index was determined for 300 patients visiting the Department of Periodontics. The oral hygiene status was assessed by using Oral Hygiene Index Simplified-1964. The Community Periodontal Index was used to assess the periodontal status with a CPITN probe.  The demographic details were collected using open ended questionnaire which included age, sex, socioeconomic status, education whereas smoking and stress were included in the close ended questionnaire.Result: The present study showed association of obesity with periodontitis. Males had higher prevalence of periodontitis. Similarly age and smoking also had a higher prevalence rate of periodontitis.Conclusion: As an oral health care professional, preserving periodontal health is the utmost responsibility. Finding and controlling new risk indicators and eliminating them is one of the most important relevance of the present study. Obesity has been identified as one more risk indicator other than age, smoking and diabetes mellitus",https://www.nepjol.info/index.php/OJN/article/download/21348/17493,,SDG 11: Sustainable Cities and Communities
0,Dil Nath Fuel,Urban Poverty Reduction Through Local Governance in Nepal,2017,India Studies in Business and Economics,Springer Singapore,https://doi.org/10.1007/978-981-10-6274-2_14,,232,2025-05-24 11:25:52,book-chapter,10.1007/978-981-10-6274-2_14,2198-0012,,,,265.0,299.0,0,0.0,0,1,8,,http://link.springer.com/content/pdf/10.1007/978-981-10-6274-2_14,,SDG 11: Sustainable Cities and Communities
2,"Dinesh Bhusal, Prashant Ghimire",Avian urban ecology in Nepal: A call for attention,2023,Nepalese Journal of Zoology,Nepal Journals Online (JOL),https://doi.org/10.3126/njz.v7i2.60810,,178,2025-05-24 11:25:52,journal-article,10.3126/njz.v7i2.60810,2705-4411,,7.0,2.0,49.0,59.0,2,1.0,1,2,2,"Urbanization is increasing at an unprecedented rate, leading to changes in land use resulting in the loss of habitat for birds worldwide. Nevertheless, urban areas still support approximately 20% of the world's bird population. In Nepal, urbanization has been rapidly increasing in recent decades, yet little attention has been paid to urban biodiversity exacerbating the impact of urban expansion on threatened birds. In this perspective article, we explore studies on urban birds in Nepal to identify existing research patterns, discuss what has been known, outline gaps and pave immediate future interventions in studies of avian urban ecology in Nepal. There has been a significantly lower number of studies on urban birds in Nepal compared to neighbouring India and China in the last 10 years. Studies of urban birds in Nepal are at a very early stage focused on the diversity and richness in Kathmandu, Pokhara and Butwal with no baseline data for other major cities. Our understanding of bird homogenization or extinction as well as the effects of birds on cities, such as their rapid colonization and potential role as pests, may be limited by this dearth of knowledge about urban birds and biodiversity. Therefore, we have outlined future research opportunities in avian urban ecology in Nepal such as long-term bird surveys, interdisciplinary field of studies, diseases study, management of urban green spaces, avian adaptation to urban environments, colonization and extinction patterns in cities, and conflicts, challenges, and management strategies related to urban avian ecology. With this article, we call the immediate attention of scientists, urban planners, and related stakeholders to use birds as a model system to study urban environments which could be a good start in building a bird-friendly city.",https://www.nepjol.info/index.php/njz/article/download/60810/45565,,SDG 11: Sustainable Cities and Communities
0,"Dinesh Bhusal, Prashant Ghimire, Matthew Low, Zuzanna M. Rosin, Yajna Prasad Timilsina","The diversity and nesting preferences of birds along an urban-rural gradient in the Kathmandu Valley, Nepal",2024,Urban Ecosystems,Springer Science and Business Media LLC,https://doi.org/10.1007/s11252-024-01631-0,,92,2025-05-24 11:25:52,journal-article,10.1007/s11252-024-01631-0,1083-8155,,28.0,1.0,,,0,0.0,0,5,1,,https://link.springer.com/content/pdf/10.1007/s11252-024-01631-0.pdf,,SDG 11: Sustainable Cities and Communities
26,"Dinesh Kumar Shahi, Hom Bahadur Rijal, Masanori Shukuya","A study on household energy-use patterns in rural, semi-urban and urban areas of Nepal based on field survey",2020,Energy and Buildings,Elsevier BV,https://doi.org/10.1016/j.enbuild.2020.110095,,151,2025-05-24 11:25:52,journal-article,10.1016/j.enbuild.2020.110095,0378-7788,,223.0,,110095.0,110095.0,26,5.2,9,3,5,,https://api.elsevier.com/content/article/PII:S0378778819330543,,SDG 11: Sustainable Cities and Communities
1,"Dinesh Kumar Shahi, Hom Bahadur Rijal, Masanori Shukuya",Study on Household Energy Usage Patterns in Urban and Rural Areas of Nepal,2020,Journal of the Institute of Engineering,Nepal Journals Online (JOL),https://doi.org/10.3126/jie.v15i3.32761,,352,2025-05-24 11:25:52,journal-article,10.3126/jie.v15i3.32761,1810-3383,,15.0,3.0,402.0,410.0,1,0.2,0,3,5,"In the last decades, the household’s energy demand has increased significantly in various countries including Nepal. In the case ofNepal, 94% of energy use is in the domestic sector. There is a possibility of a huge increase in electricity production, but we are stillsuffering from load shedding due to the high electricity demand. Electricity use is an important factor for the quality of life anddevelopment of a nation. There is not a sufficient number of researches done about electricity consumption in different climaticregions of Nepal which are analyzed by the income level of residents. This study gives descriptive information on the household’senergy uses patterns and investigates the electricity use rate, using electrical appliances in households. This study also identifies themajor source of energy use and awareness of energy use. The data were collected from 442 households in three regions in the winterseason of 2018. Kalikot is a rural area, Chitwan is a semi-urban, and Kathmandu is an urban area. We have collected electricity bills,family income, and family size, electricity using appliances, expenditure for energy and energy use for heating/cooling, cooking, andlighting. The electricity was used only for lighting purposes in the rural area, but other electrical appliances were used in semi-urbanand urban areas. The amount of electricity use has not affected by household income level in the rural area, but it has affected in semi-urban and urban areas. The level of education affects the use of the LED significantly. This study would be helpful to know theelectricity use patterns which is useful for energy saving and energy management of the rural and urban areas of Nepal.",https://www.nepjol.info/index.php/JIE/article/download/32761/25857,,SDG 11: Sustainable Cities and Communities
