Cites,Authors,Title,Year,Source,Publisher,ArticleURL,CitesURL,GSRank,QueryDate,Type,DOI,ISSN,CitationURL,Volume,Issue,StartPage,EndPage,ECC,CitesPerYear,CitesPerAuthor,AuthorCount,Age,Abstract,FullTextURL,RelatedURL,SDG
18,"Brandon A. Kohrt, Minyoung Yang, Sauharda Rai, Anvita Bhardwaj, Wietse A. Tol, Mark J. D. Jordans",Recruitment of child soldiers in Nepal: Mental health status and risk factors for voluntary participation of youth in armed groups.,2016,Peace and Conflict: Journal of Peace Psychology,American Psychological Association (APA),https://doi.org/10.1037/pac0000170,,841,2025-05-24 11:58:21,journal-article,10.1037/pac0000170,1532-7949,,22.0,3.0,208.0,216.0,18,2.0,3,6,9,"Preventing involuntary conscription and voluntary recruitment of youth into armed groups are global human rights priorities. Pathways for self-reported voluntary recruitment and the impact of voluntary recruitment on mental health have received limited attention. The objective of this study was to identify risk factors for voluntarily joining armed groups, as well as the association of conscription status and mental health. In Nepal, interviews were conducted with 258 former child soldiers who participated in a communist (Maoist) revolution. Eighty percent of child soldiers joined 'voluntarily'. Girls were 2.07 times as likely to join voluntarily (95% CI, 1.03-4.16,",http://psycnet.apa.org/journals/pac/22/3/208.pdf,,"SDG 16: Peace, Justice and Strong Institutions"
0,Chiranjibi Bhandari,Reflection on Past Assumptions Vs Present Realities of Social Reintegration in Nepal,2024,Nepal’s Peace Process,Routledge,https://doi.org/10.4324/9781003289876-7,,861,2025-05-24 11:58:21,book-chapter,10.4324/9781003289876-7,,,,,85.0,99.0,0,0.0,0,1,1,"After the Comprehensive Peace Accord (CPA) of 2006, a decade-long conflict was brought to an end. The agreement disbanded the militia of the CPN-Maoist and relocated the combatants to different cantonment sites after the UN verification process. With the CPA and other subsequent agreements signed in the period of 2006 to 2012, the issue of the management of arms and armies remained a popular debate among academics, political parties, civil societies, and policy communities. Nepal's approach of managing ex-combatants and their weapons is known as a successful homegrown model, designed and led by national actors in mutual understanding and flexible manner. This chapter revisits the ex-combatants in Nepal from the cantonment stay to the present time, including the time period from 2011 to 2020. The life experience of ex-combatants itself is interesting, as their identity has been transformed drastically, challenging their own assumptions of their role in post-conflict society. This chapter, based on personal experiences and testimonials, explicated past assumptions and the present realities of those ex- combatants.",,,"SDG 16: Peace, Justice and Strong Institutions"
2,Dahlia Simangan,Beyond Indices of Peace and Sustainability: Everyday Perspectives from Nepal,2023,Peace Review,Informa UK Limited,https://doi.org/10.1080/10402659.2023.2243244,,36,2025-05-24 11:58:21,journal-article,10.1080/10402659.2023.2243244,1040-2659,,35.0,3.0,536.0,549.0,2,1.0,2,1,2,"Click to increase image sizeClick to decrease image size ACKNOWLEDGMENTSThe author wishes to acknowledge the Network for Education and Research on Peace and Sustainability (NERPS) at Hiroshima University for the financial support provided to the data collection for this paper, Riyaz Karki of Peace Perspectives in Nepal for the local consultation and FGD facilitation, and John Lee Candelaria of Hiroshima University for the research assistance provided during the conceptualization phase of the research project. The scoping workshop participated by members of the NERPS research cluster on ""Sustainable Peace and Peaceful Sustainability in Conflict Affected Societies"" was instrumental to the conceptualization of the research for this paper. The author is also grateful to Peace Review's editorial team and two anonymous referees for their constructive feedback throughout the review process.DISCLOSURE STATEMENTNo potential conflict of interest was reported by the author(s).Additional informationNotes on contributorsDahlia SimanganDahlia Simangan is Associate Professor at Hiroshima University's Center for Peaceful and Sustainable Futures of The IDEC Institute. She contributes to the research activities of the Network for Education and Research on Peace and Sustainability (NERPS) and teaching activities of the International Peace and Co-existence Program. Prior to that, she was a Kanagawa University Japan Society for the Promotion of Science (JSPS) postdoctoral fellow for research in Japan, nominated by the United Nations University – Center for Policy Research (UNU-CPR) in Tokyo. She holds a PhD in International, Political and Strategic Studies from the Australian National University. Her research interests in peace and conflict include topics on post-conflict peacebuilding, the relationship between peace and sustainability and international relations in the Anthropocene. E-mail: simangan@hiroshima-u.ac.jp",https://www.tandfonline.com/doi/pdf/10.1080/10402659.2023.2243244,,"SDG 16: Peace, Justice and Strong Institutions"
0,Deepak Chaudhary,Hydropower Development and Economic Growth in Nepal: Challenges and Prospects,2024,Journey for Sustainable Development and Peace Journal,Nepal Journals Online (JOL),https://doi.org/10.3126/jsdpj.v2i1.63236,,528,2025-05-24 11:58:21,journal-article,10.3126/jsdpj.v2i1.63236,2976-1328,,2.0,1.0,1.0,18.0,0,0.0,0,1,1,"Nepal is rich in water resources, and hydropower development has been a key issue for the country's socio-economic development. But, it needs to produce huge amounts of electricity to support economic activities and growth, though it faces challenges. The paper attempts to fill this gap by studying hydropower development in support of economic growth and overall development, and further discussing its challenges through a literature review analysis and Key Informant Interviews. Economically, Nepal has more than 42000 MW of hydropower generation capacity, but the present generation capacity is 2945 MW, though only below more than 50 percent of the total generation capacity works out in the dry season due to low water discharge and faces a deficiency of electricity. Nepal also imports electricity from India to fulfill domestic demands in the season. There is a gap in the demand and supply lines. Hydropower has become a de-facto reality in light of economic development and the production of hydropower is crucial as Nepal exported electricity of Rs.15.4 billion worth last year. However, this study shows that the prospect of hydropower development is optimistic, though, there are several challenges in terms of priorities of needy projects, investment, environment-forest-land policies, and governance aspects. If pragmatic policy, effective governance, and leadership interventions are adopted on time, challenges can be overcome.",https://www.nepjol.info/index.php/jsdpj/article/download/63236/47799,,"SDG 16: Peace, Justice and Strong Institutions"
0,Deepak Chaudhary,The implication of ‘Smart Village’ in Nepal: Sustainable rural development perspective,2023,Journey for Sustainable Development and Peace Journal,Nepal Journals Online (JOL),https://doi.org/10.3126/jsdpj.v1i1.52595,,610,2025-05-24 11:58:21,journal-article,10.3126/jsdpj.v1i1.52595,2976-1328,,1.0,1.0,1.0,20.0,0,0.0,0,1,2,"The main objective of the study is to discuss the importance of ‘smart villages’ in Nepal considering it would enhance rural and local development. The analytical review literature of both theoretical and empirical data and documents and observation as methods are adopted for the study. The majority of the population in Nepal resides in rural areas. Similarly, rural-urban migration is common. There is a wide gap between rural and urban in terms of infrastructure development and poverty. The rural population stands for 27 % of poverty, which is higher than the urban (15%). Many parts of the local levels face a lack of infrastructure, poor public services, and technologies. The exodus of youth from villages has resulted in decreasing agriculture production. Considering topography, population, limitation of land, and migration trends; the concept of smart villages is rational and it will have evident implications for rural development. The concept of smart villages will sustainably enhance the rural economy, minimizing the rural-urban economies gap.",https://www.nepjol.info/index.php/jsdpj/article/download/52595/39394,,"SDG 16: Peace, Justice and Strong Institutions"
0,"Deepak Chaudhary, Kabita Maharjan",Climate Change Variability and its Impacts in Nepal,2023,Journey for Sustainable Development and Peace Journal,Nepal Journals Online (JOL),https://doi.org/10.3126/jsdpj.v1i02.58219,,521,2025-05-24 11:58:21,journal-article,10.3126/jsdpj.v1i02.58219,2976-1328,,1.0,2.0,47.0,57.0,0,0.0,0,2,2,"This paper aims to explore the climate variability in agriculture and discuss adaptation. Climate change has been an issue in relation to water, agriculture, and ultimately livelihood in the community. It impedes the ecosystem of nature and society. In Nepal, the temperature growth rate is increasing day by day and it reached 0.180C which contributes to climate change variability and it is contributing to the scarcity of water and hence, the impact on agricultural production. Similarly, only a small amount of available water (4.7%) in Nepal has been effectively utilized. The majority of households in Nepal depend upon agriculture and livestock. The imbalance in agriculture production is also directly related to nutrition and health. Many parts of the Karnali province have been faced with food deficiency and malnutrition. Due to the challenges, the proper utilization and sustainable use of water sources for securing food security in Nepal is imperative.  ",https://www.nepjol.info/index.php/jsdpj/article/download/58219/43508,,"SDG 16: Peace, Justice and Strong Institutions"
0,Edwin Martínez-Callejas,"Conflict, education and peace in Nepal: rebuilding education for peace and development <b>Conflict, education and peace in Nepal: rebuilding education for peace and development</b> , by Tejendra Pherali, London, Bloomsbury Academic, 2022, 240 pp., U$86.46 (Ebook), ISBN: 9781350028760, U$120.00 (hardback), ISBN: 9781350028753",2023,Journal of Peace Education,Informa UK Limited,https://doi.org/10.1080/17400201.2023.2184087,,292,2025-05-24 11:58:21,journal-article,10.1080/17400201.2023.2184087,1740-0201,,20.0,3.0,387.0,388.0,0,0.0,0,1,2,"""Conflict, education and peace in Nepal: rebuilding education for peace and development."" Journal of Peace Education, ahead-of-print(ahead-of-print), pp. 1–2",https://www.tandfonline.com/doi/pdf/10.1080/17400201.2023.2184087,,"SDG 16: Peace, Justice and Strong Institutions"
0,"Elly Harrowell, Varsha Gyawali",Nepal,2019,Comparing Peace Processes,Routledge,https://doi.org/10.4324/9781315436616-12,,41,2025-05-24 11:58:21,book-chapter,10.4324/9781315436616-12,,,,,194.0,210.0,0,0.0,0,2,6,"Nepal is one of the poorest countries in South Asia, largely dependent on agriculture and remittances through labour migration from abroad. By the time the peace agreement was signed that would bring Nepal's civil war to an end in 2006, the country had endured a decade of violent conflict between Maoist insurgents and government forces, bringing misery and destruction to the country's poorest, rural communities. Given that the conflict was driven by deep-rooted grievances around inequality, caste, ethnic and gender-based discrimination, poverty, and citizenship rights, any effective attempt to resolve it would have to address these thorny issues. The chapter demonstrates Nepal's peace process that certainly took steps to address these questions through a number of provisions included in the Comprehensive Peace Agreement, and the prospect of a return to open conflict with the Maoists now seems inconceivable, as they have been fully integrated into the mainstream political process.",,,"SDG 16: Peace, Justice and Strong Institutions"
0,Ganga Datta Nepal,An Approach of Sustainable Development Model for Water Security in Growing Cities,2023,Journey for Sustainable Development and Peace Journal,Nepal Journals Online (JOL),https://doi.org/10.3126/jsdpj.v1i1.52603,,745,2025-05-24 11:58:21,journal-article,10.3126/jsdpj.v1i1.52603,2976-1328,,1.0,1.0,81.0,90.0,0,0.0,0,1,2,"To address the growing water crisis, proper water resources management: realistic planning, and investment in water and sanitation can only achieve the Sustainable Development Goals (SDG) 2030. In developing countries like Nepal, government alone cannot deliver the required water services for the growing population of cities, still, the private sector is not interested and reluctant to invest due to the risks and low returns. Public Private partnerships (PPP) in water services have also provided mixed results for sustainable service delivery. To achieve the set target of managing water supply services of a scarce zone; need to understand the economic value and finance for water resources. Additionally, the formulation of essential and realistic policies, operational strategies, or plans for cost recovery and sustainable financing to increase services, particularly for the deprived and poor. Due to the lack of systematic knowledge, strategies for cost recovery are typically not comprehensive and fulfill only some aspects of the sustainability index. This leads to the degradation and low performance of water supply systems, resulting in the failure to deliver reliable services for the users. For a better living environment in cities, there are new and innovative ways to solve the problem of sustainable financing for water services such as blended finance, leveraging the services, involvement of the private sector, and promotion of commercial banks for sustainable financing of infrastructure for water services. Regardless, how to overcome the barriers by increasing the investments and contributions for coping of problems on water security in consideration with climate change: floods and droughts, that needs proper mitigation measures and sustainable growth in line with SDG target.",https://www.nepjol.info/index.php/jsdpj/article/download/52603/39399,,"SDG 16: Peace, Justice and Strong Institutions"
0,"Geja Sharma Wagle, Paul Jackson",Lessons from peace processes: the case of Nepal,2015,Handbook of International Security and Development,Edward Elgar Publishing,https://doi.org/10.4337/9781781955536.00035,,660,2025-05-24 11:58:21,book-chapter,10.4337/9781781955536.00035,,,,,,,0,0.0,0,2,10,,https://china.elgaronline.com/view/edcoll/9781781955529/9781781955529.xml,,"SDG 16: Peace, Justice and Strong Institutions"
3,"Gitta Shrestha, Bishnu Raj Upreti, Åshild Kolås","Women, Peace and SecurityThe case of Nepal",2017,"Women, Peace and Security in Nepal",Routledge,https://doi.org/10.4324/9781315158723-7,,17,2025-05-24 11:58:21,book-chapter,10.4324/9781315158723-7,,,,,99.0,122.0,3,0.38,1,3,8,"This chapter offers a summary of the book's key findings on Nepali women's political agency in the transition from war to peace. It also represents an effort to assess whether Nepal deserves its reputation as a case of successful transition from war to post-conflict women's empowerment. A central theme of research on women's political participation is concerned with the historically evident and widespread gender imbalances in decision-making power and the implications of this imbalance for women's access to resources, rights, and entitlements for women. Peacebuilding processes and related transitions have been viewed as the potential sites for women to advance their rights and take on a greater role in governance and politics, especially by way of constitutional revisions. Peacebuilding is thus perceived as a unique opportunity for enhancing women's empowerment in post-conflict reconstruction. The political mobilization of women was amplified in Nepal as a result of the Maoists' successful mobilization of women during the conflict.",,,"SDG 16: Peace, Justice and Strong Institutions"
0,Gyanendra Raj Sharma,Achievements and Issues in Sustainable Development in Nepal,2023,Journey for Sustainable Development and Peace Journal,Nepal Journals Online (JOL),https://doi.org/10.3126/jsdpj.v1i02.58264,,467,2025-05-24 11:58:21,journal-article,10.3126/jsdpj.v1i02.58264,2976-1328,,1.0,2.0,95.0,112.0,0,0.0,0,1,2,"By conducting a comprehensive literature study on viewpoints regarding sustainability and development, this research aims to synthesize the accomplishments and challenges associated with sustainable development. The study utilizes a review-based methodology that is based on discussions and debates among academics, scholars, and philosophers. In order to advance development narratives, sustainable development (SD) necessitates achieving a harmonious balance among three fundamental pillars: social, economic, and environmental. The literature draws the conclusion that SD has emerged around three fundamental concepts. Based on the available evidence, it can be firmly concluded that sustainability represents the sole viable pathway for achieving sustainable development. This entails the integration of profound contemplation, responsible actions, and the assimilation of valuable lessons from diverse successful practices on a global scale. While acknowledging the praiseworthy achievements resulting from historical endeavors and recent initiatives such as Agenda 2030 and the Sustainable Development Goals, it is essential to recognize the imperative of addressing the existing challenges to enhance the overall effectiveness and comprehensiveness of sustainable development efforts.",https://www.nepjol.info/index.php/jsdpj/article/download/58264/43509,,"SDG 16: Peace, Justice and Strong Institutions"
0,"Gyanu Maskey, Poshendra Satyal, Monika Giri, Prajal Pradhan",Applying a Climate Justice Framework to Understand Inequities in Urban Water Governance Amid Climate Change Challenges in Nepal,2024,Environmental Justice in Nepal,Routledge,https://doi.org/10.4324/9781003371175-28,,274,2025-05-24 11:58:21,book-chapter,10.4324/9781003371175-28,,,,,235.0,248.0,0,0.0,0,4,1,"This chapter provides empirical case studies of two Himalayan towns of Nepal – Dhulikhel and Diktel, focusing on equity and justice in (drinking) water governance, which impacted water security. We investigate the differential impacts of climate change on different local social groups and their ongoing responses to the impacts taking the case of water governance and water security. The findings of the study clearly revealed that climate change and its associated impacts on the lives of people have further exacerbated the existing inequalities among the social groups – the access to drinking water for the marginalized social groups further declined because of drying of water sources and other disasters affecting the availability of water. Based on these empirical facts, this chapter highlights the need to develop an interdisciplinary approach to advance a research and policy agenda on climate justice and disaster risk management (with valuable insights from elsewhere). We conclude that a climate justice framework is needed in the context of Nepal that considers distributional, capabilities, procedural, and recognition issues and aspects of vulnerability, resilience, and adaptive capacity. Based on the findings of the study, we also complicate the current debate around climate justice in Nepal, and how can they be applied in research and development interventions related to climate change (for adaptation) and disasters. This would help to understand which dimension of climate justice gets priority and more traction in Nepal than others amid the dynamics of social differences.",,,"SDG 16: Peace, Justice and Strong Institutions"
7,"Henri Myrttinen, Jana Naujoks, Janpeter Schilling","Gender, Natural Resources, and Peacebuilding in Kenya and Nepal",2015,Peace Review,Informa UK Limited,https://doi.org/10.1080/10402659.2015.1037623,,306,2025-05-24 11:58:21,journal-article,10.1080/10402659.2015.1037623,1040-2659,,27.0,2.0,181.0,187.0,7,0.7,2,3,10,"For approximately the past two decades, a large and growing body of both academic and grey literature from nongovernmental organizations (NGOs) or international agencies has looked at issues of gen...",http://www.tandfonline.com/doi/pdf/10.1080/10402659.2015.1037623,,"SDG 16: Peace, Justice and Strong Institutions"
5,"Hiroyuki Takeshima, Scott E. Justice",Evolution of agricultural mechanization in Nepal,2020,,International Food Policy Research Institute,https://doi.org/10.2499/9780896293809_09,,180,2025-05-24 11:58:21,report,10.2499/9780896293809_09,,,,,,,5,1.0,3,2,5,"Mechanization levels in Nepal, a largely agricultural country, were relatively low until a few decades ago. However, significant mechanization growth, including the adoption of tractors, has occurred since the 1990s, against a backdrop of rising rural wages, particularly for plowing, combined with growing emigration, growth in key staple crop yields, overall broad agricultural production growth, and improved market access and participation. This growth in mechanization has taken place despite the general absence of direct government support or promotion. The growth of tractor use in the plains of the Terai zone has transformed agricultural production rather than inducing labor movement out of agriculture. Thus it has raised overall returns to scale in intensification and enabled the cultivation of greater areas by medium smallholders than by resource-poor smallholders. Tractors have also facilitated the intensification of crop production per unit of land among very small farmers, enabling mechanization growth despite the continued decline in farm size, although these farmers may not have benefited as much as medium smallholders. Potential future research areas with policy relevance include mitigating accessibility constraints on tractor custom hiring services, identifying appropriate regulatory policies for mechanization, and providing complementary support to some smallholders who may not fully benefit from tractor adoption alone.",https://ebrary.ifpri.org/utils/getfile/collection/p15738coll2/id/134100/filename/134301.pdf,,"SDG 16: Peace, Justice and Strong Institutions"
0,Ishwori Prasad Kandel,Indo-Nepal Treaty of 1950: A Realist Perspective,2024,Journey for Sustainable Development and Peace Journal,Nepal Journals Online (JOL),https://doi.org/10.3126/jsdpj.v2i2.69561,,463,2025-05-24 11:58:21,journal-article,10.3126/jsdpj.v2i2.69561,2976-1328,,2.0,2.0,28.0,38.0,0,0.0,0,1,1,"The Indo-Nepal Treaty of Peace and Friendship, signed on July 31, 1950, between Nepal and India, was a landmark agreement aimed at fostering strong bilateral relations. The treaty facilitated free movement, residence, and business opportunities across borders, thereby enhancing mutual security and cooperation in the post-colonial South Asian context. Over the years, it has played a crucial role in promoting economic cooperation, defense collaboration, and cultural exchange. However, the treaty has also become a subject of debate due to shifting geopolitical dynamics and internal political shifts. This paper critically explores the treaty's influence on India-Nepal relations, focusing on its contributions to trade, investment, and defense collaboration. Despite these achievements, its relevance is increasingly questioned due to unresolved border disputes, China's growing presence in South Asia, and political instability within Nepal. The analysis suggests that revisiting and revising the treaty's provisions is essential to address these contemporary challenges. Ultimately, the study calls for a pragmatic approach that aligns the treaty with current geopolitical realities, ensuring a resilient and mutually beneficial partnership between India and Nepal. By adopting a realist perspective, this analysis underscores the strategic importance of adapting bilateral agreements to evolving regional dynamics.",https://www.nepjol.info/index.php/jsdpj/article/download/69561/53064,,"SDG 16: Peace, Justice and Strong Institutions"
0,Ishwori Prasad Kandel,The Maoist Insurgency and Peace Process in Nepal,2023,Pragya Darshan प्रज्ञा दर्शन,Nepal Journals Online (JOL),https://doi.org/10.3126/pdmdj.v5i1.52257,,858,2025-05-24 11:58:21,journal-article,10.3126/pdmdj.v5i1.52257,2542-2634,,5.0,1.0,23.0,28.0,0,0.0,0,1,2,"The Nepalese civil war, or People’s War, was the result of stalled peace negotiations between the democratic government and the paramilitary wing of the Communist Party of Nepal (Maoist). Nepal's first decade of democracy is considered turbulent due to frequent government changes, internal party battles and corruption. Politics continued to be dominated by the Brahmin and Chhetri castes with an underrepresentation of ethnic minorities and women. Nepal Communist Party Maoist said that the insurgency began to fight against the 250 years long monarchy, deeply rooted economic & social discrimination & prejudices, Feudal system and against all kinds of injustices & inequalities prevalent in the society.",https://www.nepjol.info/index.php/pdmdj/article/download/52257/39149,,"SDG 16: Peace, Justice and Strong Institutions"
